{
  "schema_version": 1,
  "evidence_id": "ev_01JBQ2Z8Y3K4M5N6P7Q8R9S0T1",
  "tenant_id": "tnt_01JBQ2Z8Y3K4M5N6P7Q8R9S0T1",
  "incident_id": "inc_01JBQ2Z8Y3K4M5N6P7Q8R9S0T1",
  "integration_id": "int_01JBQ2Z8Y3K4M5N6P7Q8R9S0T1",
  "source_type": "metrics",
  "tool": "metrics.query_range",
  "tool_call_id": "tc_01JBQ2Z8Y3K4M5N6P7Q8R9S0T1",
  "source_query": { "query_template": "http_latency_p95", "window_seconds": 900, "step_seconds": 30 },
  "time_window": { "start_at": "2026-10-22T05:45:00Z", "end_at": "2026-10-22T06:00:00Z" },
  "collected_at": "2026-10-22T06:00:10Z",
  "summary": "checkout p95 rose from 210ms to 950ms at 05:52Z",
  "content_hash": "sha256:9f86d081884c7d659a2feaa0c55ad015a3bf4f1b2b0b822cd15d6c15b0f00a08",
  "redaction_status": "none_needed",
  "truncated": false,
  "payload_reference": "tenants/tnt_01JBQ2Z8Y3K4M5N6P7Q8R9S0T1/incidents/inc_01JBQ2Z8Y3K4M5N6P7Q8R9S0T1/ev_01JBQ2Z8Y3K4M5N6P7Q8R9S0T1.json.zst"
}
